{
  "panel": "host_metrics",
  "range": "24h",
  "end": "2026-06-08T12:00:00Z",
  "data": {
    "cpu_percent": {
      "current": 1.3,
      "ranges": {
        "24h": [
          1.5, 1.5, 1.6, 1.8, 2.1, 1.6, 2.2, 2.2, 2.1, 2, 2, 2.4, 2.4, 1.8, 1.8, 1.8, 1.6, 2.2, 1.7,
          1.8, 1.7, 1.3, 1.6, 1.5, 0.8, 1, 0.9, 0.5, 0.4, 0.7, 0.5, 0.4, 0.2, 0.6, 0.9, 0.6, 1, 0.7,
          0.6, 0.8, 0.8, 0.7, 0.8, 0.8, 1.7, 1.3, 1.3, 1.5
        ]
      }
    },
    "mem_used_percent": {
      "current": 51.9,
      "ranges": {
        "24h": [
          50.6, 54.1, 54.1, 54.2, 52.2, 54, 53.2, 54.4, 56, 54.1, 56.6, 56.9, 55.4, 54.9, 55.1,
          55.3, 54.3, 55.9, 53.2, 51.6, 54.6, 53.4, 52.1, 52.4, 50.2, 49.5, 50, 49.2, 50.1, 50.7,
          48.7, 49.7, 49.9, 47.3, 46.7, 47.6, 49.6, 49.5, 50.1, 49.9, 51.2, 51.2, 51.4, 51.5, 52.9,
          53.9, 53.7, 51.6
        ]
      }
    },
    "disk_used_bytes_data": {
      "current": 214223698,
      "ranges": {
        "24h": [
          214616541.9, 215313157.2, 215903935.1, 215283329.4, 215843799.1, 215409812.9, 215393629.8,
          216204167.6, 217681677, 217763894.1, 217359458.4, 216790582.5, 216780099.7, 218210654.7,
          216566993, 215336518.2, 216522627, 215960891.8, 215827177.1, 215248553.5, 215118877.7,
          214078388.6, 215596271, 212409469.2, 213269997.8, 212415299.1, 213298459.4, 211311610.1,
          212717518.1, 211067372.7, 211521500.1, 212362102.5, 212720914.8, 211326186.3, 209820087.1,
          212222115.9, 211549124.9, 211830698.3, 211312734.8, 211277499.4, 211264993.4, 214363701,
          211956408.3, 212374312.7, 213374910.4, 215999335.5, 213594364, 215848876.7
        ]
      }
    },
    "disk_total_bytes_data": {
      "current": 21045336064,
      "ranges": {
        "24h": [
          21045336064, 21045336064, 21045336064, 21045336064, 21045336064, 21045336064, 21045336064,
          21045336064, 21045336064, 21045336064, 21045336064, 21045336064, 21045336064, 21045336064,
          21045336064, 21045336064, 21045336064, 21045336064, 21045336064, 21045336064, 21045336064,
          21045336064, 21045336064, 21045336064, 21045336064, 21045336064, 21045336064, 21045336064,
          21045336064, 21045336064, 21045336064, 21045336064, 21045336064, 21045336064, 21045336064,
          21045336064, 21045336064, 21045336064, 21045336064, 21045336064, 21045336064, 21045336064,
          21045336064, 21045336064, 21045336064, 21045336064, 21045336064, 21045336064
        ]
      }
    },
    "disk_used_bytes_root": {
      "current": 5726623744,
      "ranges": {
        "24h": [
          5717987906.9, 5728881691.4, 5727843661.1, 5743449971, 5777464874.2, 5738408183,
          5752565037.2, 5750313338.2, 5769570209.3, 5806979668.1, 5770737791.9, 5768837380.8,
          5759567139.7, 5773200119.1, 5759725566.2, 5793363419.4, 5795814451.6, 5789380428.4,
          5752684841.3, 5766179036.3, 5759897869.2, 5744338199.4, 5721648805.2, 5692094812.1,
          5689655505.5, 5722907309.2, 5717134272.9, 5688803327.1, 5668011261.6, 5695246873.5,
          5689168067.5, 5679312283.7, 5642522239.3, 5695244783.3, 5697222323.2, 5688168319.5,
          5647265790.4, 5670940937.9, 5700844909.6, 5682934690.7, 5715520781.4, 5714857672.9,
          5729142030.6, 5719102199, 5709228214.8, 5751770621.8, 5758991366, 5746955965.9
        ]
      }
    },
    "disk_total_bytes_root": {
      "current": 16857747456,
      "ranges": {
        "24h": [
          16857747456, 16857747456, 16857747456, 16857747456, 16857747456, 16857747456, 16857747456,
          16857747456, 16857747456, 16857747456, 16857747456, 16857747456, 16857747456, 16857747456,
          16857747456, 16857747456, 16857747456, 16857747456, 16857747456, 16857747456, 16857747456,
          16857747456, 16857747456, 16857747456, 16857747456, 16857747456, 16857747456, 16857747456,
          16857747456, 16857747456, 16857747456, 16857747456, 16857747456, 16857747456, 16857747456,
          16857747456, 16857747456, 16857747456, 16857747456, 16857747456, 16857747456, 16857747456,
          16857747456, 16857747456, 16857747456, 16857747456, 16857747456, 16857747456
        ]
      }
    }
  }
}
